{
  "schema_version": "soc_final_design_dossier_index_v1",
  "phase": "SoC-10",
  "node_id": "soc_node_001",
  "request_id": "req_soc_0001",
  "dossier_status": "COMPLETE",
  "artifact_index": {
    "soc0_node_scaffold": "soc_node_concept.md",
    "soc1_hardware_profile_validation": "soc_hardware_profile_validation_policy.json",
    "soc2_capability_report_contract": "soc_capability_report_v1",
    "soc3_task_acceptance_contract": "soc_task_acceptance_result_v1",
    "soc4_task_runner_contract": "soc_task_runner_result_v1",
    "soc5_core_connection_simulation": "soc_core_connection_simulation_result_v1",
    "soc6_human_review_handoff": "soc_human_review_queue_handoff_package_v1",
    "soc7_audit_evidence_and_reevaluation_template": "soc_audit_evidence_package_v1 + soc_re_evaluation_template_v1",
    "soc8_reports_only_reevaluation_report": "soc_re_evaluation_report_v1",
    "soc9_approval_event_and_final_seal": "soc_approval_event_record_v1 + soc_final_design_package_seal_v1"
  },
  "integrity_summary": {
    "required_count": 10,
    "present_count": 10,
    "missing_keys": []
  },
  "record_only": true,
  "audit_trace_enabled": true,
  "reverification_ready": true,
  "actual_execution": false,
  "external_send_executed": false,
  "freeze_executed": false,
  "isolation_executed": false,
  "state_change_executed": false,
  "production_status": "NO_GO",
  "timestamp_utc": "2026-06-07T00:00:00+00:00"
}
